{"authority":"local-static-synthetic-input-only","deletion":{"failure_policy":"stop-no-success-no-retry","initial_state":"retained","transitions":["request-accepted","active-state-absence-asserted","current-object-absence-asserted","version-inventory-complete-asserted","all-versions-absence-asserted","all-delete-markers-absence-asserted","attachments-absence-asserted","final-absence-asserted"],"trigger":"explicit-user-deletion","uncertainty_policy":"sticky-preserve-unconfirmed-no-unknown-to-absent","version_inventory":{"delete_markers_expected":1,"inventory_sha256":"2a5e0f2990e990be3c0e66c7b2410d37f8203682be2b67f623b147bd149b90a2","versions_expected":2},"version_policy":"all-versions-and-delete-markers"},"external_execution":{"cluster_api_invoked":false,"deployment_invoked":false,"eks_deletion":"unexecuted","external_model_invoked":false,"object_store_deletion":"unexecuted","profile":"local-static-model","provider_api_invoked":false},"fixture_data":"bounded-categorical-digest-metadata-only","legal_hold":{"authority":"separate-administrator-only","disclosed":true,"failure_state_is_hold":false,"mode":"none","retention_policy_independent":true,"uncertainty_state_is_hold":false},"prohibited_content_materialized":false,"retention":{"expiry_requires_deletion_sequence":true,"object_copy_seconds":2592000,"trusted_session_state_seconds":2592000,"user_deletion_overrides_expiry":true,"workspace":"until-explicit-workspace-deletion"},"surfaces":[{"attachment_content_present":false,"boundary":null,"classification":"central-metadata-only","content_present":false,"field_count":4,"metadata_sha256":"19be28b3b97c990cb12d94eda4ecbd1ec78e0601dddf8ca0dda7b57d27d2dd24","outcome":"ok","record_kind":"otlp-envelope","surface":"otlp"},{"attachment_content_present":false,"boundary":null,"classification":"central-metadata-only","content_present":false,"field_count":3,"metadata_sha256":"a43dce56ee290748c5049aff8c26c49f07e9826ca2aee10e70a8e169aca6fe72","outcome":"ok","record_kind":"bounded-log-record","surface":"log"},{"attachment_content_present":false,"boundary":null,"classification":"central-metadata-only","content_present":false,"field_count":5,"metadata_sha256":"680443399bd05795b49409e2729b4718b6f4667592514a534e5dd3f235d55fb6","outcome":"ok","record_kind":"bounded-report-record","surface":"report"},{"attachment_content_present":false,"boundary":null,"classification":"central-metadata-only","content_present":false,"field_count":4,"metadata_sha256":"fbe7e3f61487245b72e05a7cdeb7430c294261860bb744374131c531338bc3de","outcome":"ok","record_kind":"bounded-event-envelope","surface":"event"},{"attachment_content_present":false,"boundary":null,"classification":"central-metadata-only","content_present":false,"field_count":3,"metadata_sha256":"4082926dc4c5ec1711f278613349349d3420381a8f471f51c23be2b56d73d82e","outcome":"error","record_kind":"bounded-crash-summary","surface":"crash"},{"attachment_content_present":false,"boundary":{"anonymized":false,"attachments_included":false,"authenticated_api":true,"explicit_user_action":true,"mode":"raw","model_callable":false,"raw_payload_present":false,"sanitized":false,"sensitive":true},"classification":"authenticated-raw-export-descriptor-only","content_present":false,"field_count":9,"metadata_sha256":"d781138a0ef0c6a0829138fa9e5224a9921cd5c187d8e03d362201e668ef0c76","outcome":"ok","record_kind":"export-descriptor","surface":"export"}],"version":"cogs.stage5-privacy-deletion-suite/v1"}
